{
  "artifacts": [
    {
      "kind": "screenshot",
      "path": "pr-review/evidence/01-diff-summary.png",
      "sha256": "d8663e7d9ec62f0a5356d487e0907f698fb91b34fb8f6bcc5de873e6e3cf419f",
      "size_bytes": 73739
    },
    {
      "kind": "screenshot",
      "path": "pr-review/evidence/02-verification-summary.png",
      "sha256": "00e65a2079d72fabf8527718aeac536f9c3c3bbf756ce215b55244fb8d5b7ed5",
      "size_bytes": 29506
    },
    {
      "kind": "screenshot",
      "path": "pr-review/evidence/03-checklist-preview.png",
      "sha256": "1edf4e120af38817c6e87fef6e63cd1c610d4bfdc779c2f5cc6c9d26bfaed745",
      "size_bytes": 32972
    },
    {
      "kind": "video",
      "path": "pr-review/evidence/00-implementation-walkthrough.mp4",
      "sha256": "f04e2ad6393be7573b66b7928748e3e4b599a65dfcfe45792cf5140d054247fa",
      "size_bytes": 118882
    },
    {
      "kind": "report",
      "path": "risk-policy-report.json",
      "sha256": "a816560b77ff21c107ceef95812ff579c263d59a2e52efa074c8f7dd7d266da5",
      "size_bytes": 2274
    },
    {
      "kind": "log",
      "path": "context/changed_files.txt",
      "sha256": "01ead332eb34eba53ffe2bdfd4b6ff764209344f7ca33c6fc9a274ec9ea376bd",
      "size_bytes": 691
    }
  ],
  "assertions": [
    {
      "details": "Core media generated successfully",
      "name": "evidence_capture_completed",
      "status": "pass"
    },
    {
      "details": "Captured 3 screenshots",
      "name": "screenshots_minimum",
      "status": "pass"
    },
    {
      "details": "Captured walkthrough video",
      "name": "videos_minimum",
      "status": "pass"
    },
    {
      "details": "UI impact not detected",
      "name": "ui_screenshot_evidence",
      "status": "pass"
    },
    {
      "details": "UI impact not detected",
      "name": "ui_video_evidence",
      "status": "pass"
    }
  ],
  "captured_at": "2026-02-28T22:18:01.135845+00:00",
  "flows": [
    "diff-summary-capture",
    "verification-summary-capture",
    "checklist-preview-capture",
    "implementation-walkthrough-video"
  ],
  "head_sha": "31f49f2e8a0b892b9de86aed0064cc18772e677e",
  "summary": {
    "logs": 1,
    "reports": 1,
    "screenshots": 3,
    "ui_impact": false,
    "videos": 1
  }
}
