{
  "artifacts": [
    {
      "kind": "screenshot",
      "path": "pr-review/evidence/01-diff-summary.png",
      "sha256": "a9a95517731088b9ef5cb96b53eb5315cd76580755b145d07f99c8f2402a5f39",
      "size_bytes": 70093
    },
    {
      "kind": "screenshot",
      "path": "pr-review/evidence/02-verification-summary.png",
      "sha256": "9dd590c28416cd262c597cfa63b8c452e386978d49c9f391f112dff646775275",
      "size_bytes": 24054
    },
    {
      "kind": "screenshot",
      "path": "pr-review/evidence/03-checklist-preview.png",
      "sha256": "1edf4e120af38817c6e87fef6e63cd1c610d4bfdc779c2f5cc6c9d26bfaed745",
      "size_bytes": 32972
    },
    {
      "kind": "video",
      "path": "pr-review/evidence/00-implementation-walkthrough.mp4",
      "sha256": "a2d5c9b16ec5b35b7d5c5fec46e14b167b93beaa0a8037e9245146c003dde29f",
      "size_bytes": 111851
    },
    {
      "kind": "log",
      "path": "context/changed_files.txt",
      "sha256": "6790e362786303ac8eaa6fb259f0726fb832a33e9535da62a265c4aa9fcc3775",
      "size_bytes": 480
    }
  ],
  "assertions": [
    {
      "details": "Core media generated successfully",
      "name": "evidence_capture_completed",
      "status": "pass"
    },
    {
      "details": "Captured 3 screenshots",
      "name": "screenshots_minimum",
      "status": "pass"
    },
    {
      "details": "Captured walkthrough video",
      "name": "videos_minimum",
      "status": "pass"
    },
    {
      "details": "UI impact not detected",
      "name": "ui_screenshot_evidence",
      "status": "pass"
    },
    {
      "details": "UI impact not detected",
      "name": "ui_video_evidence",
      "status": "pass"
    }
  ],
  "captured_at": "2026-02-28T17:31:07.872610+00:00",
  "flows": [
    "diff-summary-capture",
    "verification-summary-capture",
    "checklist-preview-capture",
    "implementation-walkthrough-video"
  ],
  "head_sha": "42894e6981157121240aaf78298aae4e1ffbddeb",
  "summary": {
    "logs": 1,
    "reports": 0,
    "screenshots": 3,
    "ui_impact": false,
    "videos": 1
  }
}
