{
  "artifacts": [
    {
      "kind": "screenshot",
      "path": "pr-review/evidence/01-diff-summary.png",
      "sha256": "c46862781964d9f74b93e22567f1090e288bdef0ba97b458dfd314dfb5052978",
      "size_bytes": 73672
    },
    {
      "kind": "screenshot",
      "path": "pr-review/evidence/02-verification-summary.png",
      "sha256": "deb92b683119e017bc1ab8b9b2de67d0282311f7ab5d494bbd3a07426b3e4f88",
      "size_bytes": 35624
    },
    {
      "kind": "screenshot",
      "path": "pr-review/evidence/03-checklist-preview.png",
      "sha256": "1edf4e120af38817c6e87fef6e63cd1c610d4bfdc779c2f5cc6c9d26bfaed745",
      "size_bytes": 32972
    },
    {
      "kind": "video",
      "path": "pr-review/evidence/00-implementation-walkthrough.mp4",
      "sha256": "0c851c84651e4fe3ce8623ba470eeab340cdc1b902f5e9fb3d2383b458e2deaa",
      "size_bytes": 124141
    },
    {
      "kind": "report",
      "path": "risk-policy-report.json",
      "sha256": "d61f0eeff0b49e0d5608b3b1822bcbf9d6e1ffad1f3ec74e11f86938f86792fe",
      "size_bytes": 2321
    },
    {
      "kind": "log",
      "path": "context/changed_files.txt",
      "sha256": "01ead332eb34eba53ffe2bdfd4b6ff764209344f7ca33c6fc9a274ec9ea376bd",
      "size_bytes": 691
    }
  ],
  "assertions": [
    {
      "details": "Core media generated successfully",
      "name": "evidence_capture_completed",
      "status": "pass"
    },
    {
      "details": "Captured 3 screenshots",
      "name": "screenshots_minimum",
      "status": "pass"
    },
    {
      "details": "Captured walkthrough video",
      "name": "videos_minimum",
      "status": "pass"
    },
    {
      "details": "UI impact not detected",
      "name": "ui_screenshot_evidence",
      "status": "pass"
    },
    {
      "details": "UI impact not detected",
      "name": "ui_video_evidence",
      "status": "pass"
    }
  ],
  "captured_at": "2026-02-28T22:21:51.378837+00:00",
  "flows": [
    "diff-summary-capture",
    "verification-summary-capture",
    "checklist-preview-capture",
    "implementation-walkthrough-video"
  ],
  "head_sha": "015eb86e7596271b05d321beac61a9b2d56b5c1d",
  "summary": {
    "logs": 1,
    "reports": 1,
    "screenshots": 3,
    "ui_impact": false,
    "videos": 1
  }
}
